{"schemaVersion":1,"generatedAt":"2026-10-31T06:57:58.428Z","publisher":"HagiCode","source":"https://github.com/HagiCode-org/hagitask-community-packages","tasks":[{"taskId":"add-community-task","name":{"en-US":"Add Community Task","zh-CN":"Add Community Task"},"summary":{"en-US":"Collect one complete Community Task brief, structure it with the prompt, generate every required package file, validate it for real, and open a pull request from your own GitHub fork.","zh-CN":"在一个集中说明中收集 Community Task 意图，由提示词完成结构化整理，生成全部必需的包文件，真实执行校验，并从你自己的 GitHub fork 创建 Pull Request。"},"category":"authoring","tags":["authoring","community","community-packages","scaffolding","github-pull-request","bilingual"],"publisher":"Hagicode Team","source":"https://github.com/HagiCode-org/hagitask-community-packages","version":"1.0.2","publishedAt":"2026-10-31T06:57:58.428Z","detailUrl":"/tasks/add-community-task.json","packageUrl":"/packages/add-community-task.zip","compatibility":{"agent":"any","skills":[],"cli":[{"name":"gh","command":"gh","args":["--version"]},{"name":"git","command":"git","args":["--version"]},{"name":"node","command":"node","args":["--version"]}]},"integrity":{"algorithm":"sha256","sha256":"502c0c9fdea20a1f876b469c6eb77e8f07ffb39608f940fc2a38d1429b16a5db"}},{"taskId":"agents-md-update","name":{"en-US":"AGENTS.md Update","zh-CN":"AGENTS.md 更新"},"summary":{"en-US":"A structured documentation-maintenance task preset that updates only AGENTS.md with explicit project selection and MonoSpecs-aware repository scope, leaving CLAUDE.md untouched.","zh-CN":"一个仅更新 AGENTS.md 的结构化文档维护 task preset，支持显式项目选择与 MonoSpecs 感知仓库范围，保持 CLAUDE.md 原样。"},"category":"documentation","tags":["documentation","maintenance","agents-md","monospecs"],"publisher":"Hagicode Team","source":"https://github.com/HagiCode-org/hagitask-community-packages","version":"2.0.0","publishedAt":"2026-10-31T06:57:58.428Z","detailUrl":"/tasks/agents-md-update.json","packageUrl":"/packages/agents-md-update.zip","compatibility":{"agent":"any","skills":[],"cli":[]},"integrity":{"algorithm":"sha256","sha256":"fe79fc28724431a28cfa57f74d9c64af49d58e409d7077a61068fddf05aaa69a"}},{"taskId":"codegraph-tasks","name":{"en-US":"CodeGraph Tasks","zh-CN":"CodeGraph 任务"},"summary":{"en-US":"Run localized CodeGraph lifecycle and graph-backed architecture tasks across eligible repositories.","zh-CN":"对合格仓库执行本地化的 CodeGraph 生命周期和基于图的架构任务。"},"category":"codegraph","tags":["codegraph","architecture","repository","automation"],"publisher":"HagiCode Team","source":"https://github.com/HagiCode-org/hagitask-community-packages","version":"1.0.1","publishedAt":"2026-10-31T06:57:58.428Z","detailUrl":"/tasks/codegraph-tasks.json","packageUrl":"/packages/codegraph-tasks.zip","compatibility":{"agent":"any","skills":[],"cli":[]},"integrity":{"algorithm":"sha256","sha256":"3d9a8a989fdbc94b3f814112ee45b1cb68c6e9e4d730ba0da964fc3c6325f2c5"}},{"taskId":"github-tasks","name":{"en-US":"GitHub Tasks","zh-CN":"GitHub 任务"},"summary":{"en-US":"Run focused GitHub management commands through gh CLI without persistent local artifacts.","zh-CN":"通过 gh CLI 运行专注的 GitHub 管理命令，不留下持久化本地文件。"},"category":"github","tags":["github","repository-metadata","gh-cli","automation"],"publisher":"HagiCode Team","source":"https://github.com/HagiCode-org/hagitask-community-packages","version":"1.0.2","publishedAt":"2026-10-31T06:57:58.428Z","detailUrl":"/tasks/github-tasks.json","packageUrl":"/packages/github-tasks.zip","compatibility":{"agent":"any","skills":[],"cli":[{"name":"gh","command":"gh","args":["--version"]},{"name":"node","command":"node","args":["--version"]}]},"integrity":{"algorithm":"sha256","sha256":"1a0c8a330b8fcbffd92c7f15700964ed2fb13e77bccb00129bbcd2f4b6ba6294"}},{"taskId":"goal","name":{"en-US":"Goal","zh-CN":"Goal"},"summary":{"en-US":"A bundled sustained-work preset that routes work through `/goal` and limits execution to compatible Claude and Codex heroes.","zh-CN":"一个内置的持续工作预设，通过 `/goal` 路由任务，并把执行限制在兼容的 Claude / Codex 英雄上。"},"category":"sustained-work","tags":["sustained-work","repository-scoped","compatibility-aware"],"publisher":"Hagicode Team","source":"https://github.com/HagiCode-org/hagitask-community-packages","version":"1.0.1","publishedAt":"2026-10-31T06:57:58.428Z","detailUrl":"/tasks/goal.json","packageUrl":"/packages/goal.zip","compatibility":{"agent":"any","skills":[],"cli":[]},"integrity":{"algorithm":"sha256","sha256":"7d4a395c6b9ffbc9f4f47e8b51a9d2a8795542f3a007f38936c7cfda20081567"}},{"taskId":"hagicode-monospecs-operations","name":{"en-US":"HagiCode MonoSpecs Operations","zh-CN":"HagiCode MonoSpecs 操作"},"summary":{"en-US":"Initialize MonoSpecs configuration, batch-add repositories, and reorder repositories by observable activity through a structured task.","zh-CN":"通过结构化任务初始化 MonoSpecs 配置、批量添加仓库并按活跃状态调整仓库顺序。"},"category":"configuration","tags":["configuration","repositories","monospecs","bilingual","validation"],"publisher":"Hagicode Team","source":"https://github.com/HagiCode-org/hagitask-community-packages","version":"1.0.3","publishedAt":"2026-10-31T06:57:58.428Z","detailUrl":"/tasks/hagicode-monospecs-operations.json","packageUrl":"/packages/hagicode-monospecs-operations.zip","compatibility":{"agent":"any","skills":[],"cli":[{"name":"git","command":"git","args":["--version"]},{"name":"node","command":"node","args":["--version"]}]},"integrity":{"algorithm":"sha256","sha256":"51f9b99e5e76976434aa0cc08279e11c079dc426e065d8cc14e460fd458dc784"}},{"taskId":"last30days","name":{"en-US":"last30days","zh-CN":"last30days"},"summary":{"en-US":"A structured research task preset that maps shared preset-task input into a mode-aware `last30days` workflow with explicit repository scope.","zh-CN":"一个结构化研究 task preset，把共享 preset-task 输入映射成具备模式感知能力的 `last30days` 工作流，并显式保留仓库范围。"},"category":"research","tags":["research","analysis","repository-scoped","command-driven"],"publisher":"Hagicode Team","source":"https://github.com/HagiCode-org/hagitask-community-packages","version":"1.0.1","publishedAt":"2026-10-31T06:57:58.428Z","detailUrl":"/tasks/last30days.json","packageUrl":"/packages/last30days.zip","compatibility":{"agent":"any","skills":["last30days"],"cli":[]},"integrity":{"algorithm":"sha256","sha256":"b481a8fff69de59041c4e6e0eef11833a91e545e768b815450b54714bb1b3f2f"}},{"taskId":"openspec-spec-compress","name":{"en-US":"OpenSpec Spec Compress","zh-CN":"OpenSpec Spec Compress"},"summary":{"en-US":"A bundled OpenSpec maintenance preset that turns the documented spec-compression workflow into a reusable, non-interactive task entry.","zh-CN":"一个内置的 OpenSpec 维护 preset，把文档化的 spec 压缩流程收敛成可复用、默认非交互的任务入口。"},"category":"openspec","tags":["openspec","maintenance","spec-compression"],"publisher":"Hagicode Team","source":"https://github.com/HagiCode-org/hagitask-community-packages","version":"1.0.1","publishedAt":"2026-10-31T06:57:58.428Z","detailUrl":"/tasks/openspec-spec-compress.json","packageUrl":"/packages/openspec-spec-compress.zip","compatibility":{"agent":"any","skills":[],"cli":[{"name":"openspec","command":"openspec","args":["--help"]}]},"integrity":{"algorithm":"sha256","sha256":"c929c3642623f8469a72ed3c19f0823259df4142ad66ffd276423e3367246dac"}},{"taskId":"ui-master","name":{"en-US":"UI Master","zh-CN":"UI Master"},"summary":{"en-US":"A structured UI task preset that combines command-guided intent, repository scope, and scene-aware dispatch for focused interface work.","zh-CN":"一个面向结构化 UI 任务的 task preset，把命令驱动意图、仓库范围和场景化派发组合到同一个契约里。"},"category":"ui","tags":["ui","design-tools","scene-aware","repository-scoped","command-driven"],"publisher":"Hagicode Team","source":"https://github.com/HagiCode-org/hagitask-community-packages","version":"1.0.2","publishedAt":"2026-10-31T06:57:58.428Z","detailUrl":"/tasks/ui-master.json","packageUrl":"/packages/ui-master.zip","compatibility":{"agent":"any","skills":["impeccable"],"cli":[]},"integrity":{"algorithm":"sha256","sha256":"418b2dd19dadf8e413819884513207b2e23fa33753d9dc699ffe0dae47735cf0"}}]}